{
  "$schema": "https://json-schema.org/draft/2020-12/schema",
  "$id": "https://socioprophet.org/contracts/evidence/platform-receipt-spine-binding.v0.1.json",
  "title": "PlatformReceiptSpineBinding",
  "type": "object",
  "required": [
    "apiVersion",
    "kind",
    "platformReceiptRef",
    "platformReceiptKind",
    "receiptSpineRef",
    "receiptSpineKind",
    "subjectRef",
    "issuedTimeUtc",
    "standardsRefs",
    "fieldMappings"
  ],
  "properties": {
    "apiVersion": { "const": "prophet-platform.socioprophet.org/v0.1" },
    "kind": { "const": "PlatformReceiptSpineBinding" },
    "platformReceiptRef": { "type": "string" },
    "platformReceiptKind": { "type": "string" },
    "receiptSpineRef": {
      "type": "string",
      "pattern": "^urn:srcos:receipt:"
    },
    "receiptSpineKind": {
      "type": "string",
      "enum": [
        "ObservationReceipt",
        "ValidationReceipt",
        "PromotionReceipt",
        "PublicationReceipt",
        "ExecutionReceipt",
        "ReplayReceipt"
      ]
    },
    "subjectRef": { "type": "string" },
    "issuedTimeUtc": { "type": "string", "format": "date-time" },
    "standardsRefs": {
      "type": "object",
      "required": ["receiptSpine", "standardsStorageCommit"],
      "properties": {
        "receiptSpine": { "type": "string" },
        "standardsStorageCommit": { "type": "string" }
      },
      "additionalProperties": false
    },
    "fieldMappings": {
      "type": "array",
      "minItems": 1,
      "items": {
        "type": "object",
        "required": ["platformField", "receiptSpineField", "required"],
        "properties": {
          "platformField": { "type": "string" },
          "receiptSpineField": { "type": "string" },
          "required": { "type": "boolean" },
          "notes": { "type": ["string", "null"] }
        },
        "additionalProperties": false
      }
    },
    "fogstackArtifactRefs": {
      "type": "array",
      "items": { "type": "string" }
    },
    "notes": { "type": ["string", "null"] }
  },
  "additionalProperties": false
}
